{"contract_version":"patent-research.v2","artifact_type":"RouteMap","corpus_id":"sha256:0000000000000000000000000000000000000000000000000000000000000000","cutoff":"2026-07-17","routes":[{"route_id":"route-1","name":"staged combustion","problem":"flashback control","components":["combustor"],"mechanisms":["staging"],"claimed_outcomes":["stable flame"],"member_pns":["CN1A"],"evidence_ids":["sha256:1111111111111111111111111111111111111111111111111111111111111111"],"counter_evidence_ids":[]}],"insights":[{"statement":"The fixture contains one staged route.","strength":"observed","evidence_ids":["sha256:1111111111111111111111111111111111111111111111111111111111111111"]}],"limitations":["single-record fixture"],"search_gap_requests":[]}
